Rule	Tags	Level	Weight	Category	Subcategory	Originator	Notes
What do you love best about your job?		2		Truth		Internet	
What do you think is the most important skill to have in your job?		2		Truth		Internet	
What is the strangest thing that you find attractive in a person?		2		Truth		Internet	
What is your mundane superpower?		1		Truth		Internet	
What is your proudest accomplishment?		3		Truth		Internet	
What movie(s) have you watched over and over again? Why?		2		Truth		Internet	
What old person habits do you have?		1		Truth		Internet	
What part of your job do you wish you could automate?		2		Truth		Internet	
What pet peeve drives you the craziest?		2		Truth		Internet	
What qualities do you look for in a partner?		3		Truth		Internet	
What three words would you use to describe yourself?		2		Truth		Internet	
What was your favorite food to eat growing up?		1		Truth		Internet	
What was your first job?		2		Truth		Internet	
What would the title of your memoir be?		3		Truth		Internet	
What would you be doing now if you weren't in this profession?		3		Truth		Internet	
What's an opinion you've had that has changed over time?		3		Truth		Internet	
What's something that you used to dislike, but like now?		2		Truth		Internet	
What's the best book you've ever read?		3		Truth		Internet	
What's the number one item on your bucket list?		3		Truth		Internet	
What's your best memory from childhood?		3		Truth		Internet	
What's your best quality?		2		Truth		Internet	
What's your definition of success?		3		Truth		Internet	
What's your dream vacation destination?		2		Truth		Internet	
What's your favorite recipe to make?		2		Truth		Internet	
What's your favorite restaurant?		2		Truth		Internet	
What's your favorite song to sing in the shower?		1		Truth		Internet	
What's your favorite thing about a first date?		2		Truth		Internet	
What's your favorite thing to do outside?		2		Truth		Internet	
What's your go-to comfort food?		1		Truth		Internet	
Where do you find inspiration?		2		Truth		Internet	
Which fictional character would you love to date?		1		Truth		Internet	
Who was your first kiss? What was it like?		3		Truth		Internet	
